user_input,output,flag,username,timestamp
where can i get a house,"There are several ways to find a house:

1. Real estate websites: There are many websites available that list properties for sale. Some of the more popular websites include Zillow, Realtor.com, and Redfin.

2. Real estate agents: You can work with a local real estate agent who can help you find a property that meets your needs and budget. They have access to the Multiple Listing Service (MLS) which is a database of all the properties for sale in the local area.

3. For Sale By Owner (FSBO) properties: Some homeowners may choose to sell their property without the assistance of a real estate agent. You can find these properties by searching on websites like FSBO.com or Craigslist.

4. Auctions: You can buy a house at an auction, either in person or online. However, be aware that the process can be competitive and requires careful research and preparation.

5. Direct mail campaigns: Some investors or wholesalers send mail to homeowners with a distressed property that they are interested in selling.

Ultimately, the best way to find a house depends on your specific goals and preferences. It is recommended to work with a professional to help guide you through the process and ensure that you make a sound investment.",,,2023-04-15 18:17:28.318630
what advice would you give for budgeting and investing,"Here are a few essential pieces of advice when it comes to budgeting and investing:

1. Make a comprehensive budget: It is essential to have a proper plan of your expenses to ensure that your income covers your expenses. Make sure to allocate your income to your essential expenses like rent, bills, groceries, and emergency expenses, and also allocate some portion to your savings and investment.

2. Prioritize paying off debt: If you have any outstanding debt, it is best to make it a priority to clear it off as soon as possible. High-interest debt can lead to a financial burden and drain your resources, which can prevent you from saving and investing in the future.

3. Set realistic goals: It's essential to set achievable goals while budgeting and investing. Whether it be saving for retirement, buying a home, or starting a business, set a reasonable and realistic timeframe for achieving your goals.

4. Diversify your investments: Investing involves risk, and it is crucial to diversify your investments to minimize risk. Consider including stocks, bonds, and real estate in your portfolio to help balance risk and reward.

5. Consult a financial advisor: Budgeting and investing can be complex, and it's always helpful to seek professional advice from a financial advisor. They can help you set financial goals and develop a comprehensive plan for managing your finances.

Remember, budgeting and investing are long-term processes, and it's essential to remain patient and disciplined to see the benefits of your efforts in the long run.",,,2023-04-16 09:59:17.416448
